[
  {
    "open": 283.50,
    "high": 287.20,
    "low": 282.10,
    "close": 285.50,
    "volume": 125430000,
    "begin": "2025-10-06T10:00:00+03:00",
    "end": "2025-10-06T23:50:00+03:00",
    "value": 35678250000.00
  },
  {
    "open": 280.75,
    "high": 284.90,
    "low": 279.50,
    "close": 283.50,
    "volume": 98560000,
    "begin": "2025-10-05T10:00:00+03:00",
    "end": "2025-10-05T23:50:00+03:00",
    "value": 27845120000.00
  },
  {
    "open": 278.20,
    "high": 281.60,
    "low": 277.30,
    "close": 280.75,
    "volume": 87340000,
    "begin": "2025-10-04T10:00:00+03:00",
    "end": "2025-10-04T23:50:00+03:00",
    "value": 24432890000.00
  }
]

